"90011,Customer#000090011,""xFjMzU2,yEGofqyw7nZoskMDw"",7,17-689-842-8607,8976.34,FURNITURE,es affix furiously. quickly bold deposits haggle carefully "
"90012,Customer#000090012,""C3zzg8i5bCY,pof85Bji9qaQnNr"",10,20-104-515-4749,9476.13,AUTOMOBILE,""play regular, final patterns: carefully bold asymptotes boost. instruct"""
"90013,Customer#000090013,rcwLEylrm0R,22,32-188-333-3461,5385.23,FURNITURE,ironic accounts according to the pending asymptotes are slyly according to the "
"90014,Customer#000090014,xm4pmLuO5h1Keibu3,8,18-533-487-1279,-480.03,AUTOMOBILE,leep fluffily pending packages. slyly express instructions after the regularl"
"90015,Customer#000090015,""GCxAmXPQvoyCvLhzK2,l9ViEuL9v JwTTLKURVEf"",21,31-699-866-4986,4052.63,FURNITURE,ites. express accounts nag carefully un"
"90016,Customer#000090016,""P38wXe2v ommXhlugc,q3CQG8mjvbLYlg9puRO"",1,11-343-891-9819,9511.12,MACHINERY,ngly ironic instructions cajole q"
"90017,Customer#000090017,""9ma4vCeUTYsvGXCJ0c1LgfgU7F,in"",6,16-805-322-6695,-551.89,BUILDING,e furiously slyly bold accounts. platelets haggle blithely pending reque"
"90018,Customer#000090018,zWnXkH8jLV4geMx89pl5eoCYP,10,20-721-131-1990,6265.79,HOUSEHOLD,quickly quickly final ideas. courts use-- fluffily final packages sleep ruthlessly. ironi"
"90019,Customer#000090019,pVWfXfLwZXYHqb499fhiGXCvH,19,29-628-375-1693,4184.41,FURNITURE,blithely regular instructions are. furiously ironic theodolites are quickly. furiously stealthy requests "
"90020,Customer#000090020,""qkxTrtFNQn,fCbKB3kLi2gTydJ"",2,12-262-957-2792,2456.73,BUILDING,ular deposits cajole slyly about the courts. slyly even deposits against the furiously clo"